{
  "assessments": [
    {
      "confidentiality_end_year": 2038,
      "finding_id": "finding-1cb89ca10dfb85bb1360aa8f",
      "hndl_relevant": false,
      "policy_version": "1.0",
      "reasons": [
        "registry base risk: 15 (acceptable)",
        "internal exposure: +7"
      ],
      "score": 22,
      "severity": "low"
    },
    {
      "confidentiality_end_year": 2038,
      "finding_id": "finding-220302f11677bb0224d522ef",
      "hndl_relevant": false,
      "policy_version": "1.0",
      "reasons": [
        "registry base risk: 35 (context-dependent)",
        "internal exposure: +7"
      ],
      "score": 42,
      "severity": "medium"
    },
    {
      "confidentiality_end_year": 2038,
      "finding_id": "finding-258dfa039da11219844d1f89",
      "hndl_relevant": false,
      "policy_version": "1.0",
      "reasons": [
        "registry base risk: 8 (hybrid-transition)",
        "internal exposure: +7"
      ],
      "score": 15,
      "severity": "low"
    },
    {
      "confidentiality_end_year": 2038,
      "finding_id": "finding-25a28d91fa7ae9352312cb40",
      "hndl_relevant": false,
      "policy_version": "1.0",
      "reasons": [
        "registry base risk: 100 (broken)",
        "internal exposure: +7"
      ],
      "score": 100,
      "severity": "critical"
    },
    {
      "confidentiality_end_year": 2038,
      "finding_id": "finding-31db6dcfff8c6564c421dfcf",
      "hndl_relevant": true,
      "policy_version": "1.0",
      "reasons": [
        "registry base risk: 35 (transition)",
        "internal exposure: +7",
        "HNDL planning horizon ends in 2038, at/after transition target 2030: +20"
      ],
      "score": 62,
      "severity": "high"
    },
    {
      "confidentiality_end_year": 2038,
      "finding_id": "finding-4a662e022abdcc03f0c5b643",
      "hndl_relevant": true,
      "policy_version": "1.0",
      "reasons": [
        "registry base risk: 38 (transition)",
        "internal exposure: +7",
        "HNDL planning horizon ends in 2038, at/after transition target 2030: +20"
      ],
      "score": 65,
      "severity": "high"
    },
    {
      "confidentiality_end_year": 2038,
      "finding_id": "finding-4b6595ec18b3af2c5aa83df3",
      "hndl_relevant": true,
      "policy_version": "1.0",
      "reasons": [
        "registry base risk: 35 (transition)",
        "internal exposure: +7",
        "HNDL planning horizon ends in 2038, at/after transition target 2030: +20"
      ],
      "score": 62,
      "severity": "high"
    },
    {
      "confidentiality_end_year": 2038,
      "finding_id": "finding-512d430e561cd9ae204d0dc4",
      "hndl_relevant": false,
      "policy_version": "1.0",
      "reasons": [
        "registry base risk: 5 (inventory-only)",
        "internal exposure: +7"
      ],
      "score": 12,
      "severity": "low"
    },
    {
      "confidentiality_end_year": 2038,
      "finding_id": "finding-59942782605b0fcbdcce0dcc",
      "hndl_relevant": false,
      "policy_version": "1.0",
      "reasons": [
        "registry base risk: 95 (deprecated)",
        "internal exposure: +7"
      ],
      "score": 100,
      "severity": "critical"
    },
    {
      "confidentiality_end_year": 2038,
      "finding_id": "finding-5c89578c5c7bd296937798ec",
      "hndl_relevant": false,
      "policy_version": "1.0",
      "reasons": [
        "registry base risk: 28 (context-dependent)",
        "internal exposure: +7"
      ],
      "score": 35,
      "severity": "medium"
    },
    {
      "confidentiality_end_year": 2038,
      "finding_id": "finding-7f4a29bbccd058d61cd89eaa",
      "hndl_relevant": false,
      "policy_version": "1.0",
      "reasons": [
        "registry base risk: 6 (pqc-standard)",
        "internal exposure: +7"
      ],
      "score": 13,
      "severity": "low"
    },
    {
      "confidentiality_end_year": 2038,
      "finding_id": "finding-840aec07bc43b39bfd5294a4",
      "hndl_relevant": true,
      "policy_version": "1.0",
      "reasons": [
        "registry base risk: 40 (transition)",
        "internal exposure: +7",
        "HNDL planning horizon ends in 2038, at/after transition target 2030: +20"
      ],
      "score": 67,
      "severity": "high"
    },
    {
      "confidentiality_end_year": 2038,
      "finding_id": "finding-8d68bfc1546590b632eb0eb9",
      "hndl_relevant": false,
      "policy_version": "1.0",
      "reasons": [
        "registry base risk: 6 (pqc-standard)",
        "internal exposure: +7"
      ],
      "score": 13,
      "severity": "low"
    },
    {
      "confidentiality_end_year": 2038,
      "finding_id": "finding-8e11fb768b7a7ca7fcb1f3cd",
      "hndl_relevant": false,
      "policy_version": "1.0",
      "reasons": [
        "registry base risk: 85 (deprecated)",
        "internal exposure: +7"
      ],
      "score": 92,
      "severity": "critical"
    },
    {
      "confidentiality_end_year": 2038,
      "finding_id": "finding-9081e0316f1dba0db126e063",
      "hndl_relevant": true,
      "policy_version": "1.0",
      "reasons": [
        "registry base risk: 48 (transition)",
        "internal exposure: +7",
        "HNDL planning horizon ends in 2038, at/after transition target 2030: +20"
      ],
      "score": 75,
      "severity": "high"
    },
    {
      "confidentiality_end_year": 2038,
      "finding_id": "finding-a79e26807b6ef69e6c2f6528",
      "hndl_relevant": false,
      "policy_version": "1.0",
      "reasons": [
        "registry base risk: 5 (acceptable)",
        "internal exposure: +7"
      ],
      "score": 12,
      "severity": "low"
    },
    {
      "confidentiality_end_year": 2038,
      "finding_id": "finding-ad498a9a6c00d98af8cba082",
      "hndl_relevant": false,
      "policy_version": "1.0",
      "reasons": [
        "registry base risk: 5 (inventory-only)",
        "internal exposure: +7"
      ],
      "score": 12,
      "severity": "low"
    },
    {
      "confidentiality_end_year": 2038,
      "finding_id": "finding-afc045b89bf4c0b148ba81e3",
      "hndl_relevant": true,
      "policy_version": "1.0",
      "reasons": [
        "registry base risk: 38 (transition)",
        "internal exposure: +7",
        "HNDL planning horizon ends in 2038, at/after transition target 2030: +20"
      ],
      "score": 65,
      "severity": "high"
    },
    {
      "confidentiality_end_year": 2038,
      "finding_id": "finding-b4a08e52a28a89a27da64c16",
      "hndl_relevant": true,
      "policy_version": "1.0",
      "reasons": [
        "registry base risk: 38 (transition)",
        "internal exposure: +7",
        "HNDL planning horizon ends in 2038, at/after transition target 2030: +20"
      ],
      "score": 65,
      "severity": "high"
    },
    {
      "confidentiality_end_year": 2038,
      "finding_id": "finding-b8a4ed4dcc28ccfc50493154",
      "hndl_relevant": false,
      "policy_version": "1.0",
      "reasons": [
        "registry base risk: 5 (acceptable)",
        "internal exposure: +7"
      ],
      "score": 12,
      "severity": "low"
    },
    {
      "confidentiality_end_year": 2038,
      "finding_id": "finding-f3a8b650e084d8ad5bd98fce",
      "hndl_relevant": true,
      "policy_version": "1.0",
      "reasons": [
        "registry base risk: 38 (transition)",
        "internal exposure: +7",
        "HNDL planning horizon ends in 2038, at/after transition target 2030: +20"
      ],
      "score": 65,
      "severity": "high"
    },
    {
      "confidentiality_end_year": 2038,
      "finding_id": "finding-fbff1b06d57a68c9cb991e3a",
      "hndl_relevant": false,
      "policy_version": "1.0",
      "reasons": [
        "registry base risk: 35 (context-dependent)",
        "internal exposure: +7"
      ],
      "score": 42,
      "severity": "medium"
    }
  ],
  "document_id": "urn:cbom:sha256:26f6c19b2816a265a21f88ef6186dbf2e6017ccfc2c0d8d1c32c0cf6c15726ba",
  "findings": [
    {
      "algorithm": "AES-128",
      "asset_id": "asset-b6245272c06bef7a05763959",
      "asset_kind": "configuration",
      "confidentiality_years": 12,
      "evidence": [
        {
          "confidence": 0.82,
          "detector": "configuration-token",
          "excerpt_hash": "sha256:6b0ba8d85a93de1d5bd57d7cd0fde49b28fb1fbdfac83da0ec00f5ed4ecf88c3",
          "locator": "line:2",
          "source": "application.env.example"
        }
      ],
      "exposure": "internal",
      "finding_id": "finding-1cb89ca10dfb85bb1360aa8f",
      "key_bits": null,
      "library_version": null,
      "metadata": {},
      "protocol_version": null,
      "use": "declared cryptographic algorithm"
    },
    {
      "algorithm": "TLS-1.2",
      "asset_id": "asset-d1dbb67fab6e778d880118cb",
      "asset_kind": "protocol",
      "confidentiality_years": 12,
      "evidence": [
        {
          "confidence": 0.82,
          "detector": "configuration-token",
          "excerpt_hash": "sha256:02420f582aaa14185cf10efd423be94240619f26a622f85c0c6ed4f21c7977aa",
          "locator": "line:3",
          "source": "service.yaml"
        }
      ],
      "exposure": "internal",
      "finding_id": "finding-220302f11677bb0224d522ef",
      "key_bits": null,
      "library_version": null,
      "metadata": {},
      "protocol_version": "TLS-1.2",
      "use": "transport protocol"
    },
    {
      "algorithm": "X25519MLKEM768",
      "asset_id": "asset-9347c11a76402fd349ae57d1",
      "asset_kind": "configuration",
      "confidentiality_years": 12,
      "evidence": [
        {
          "confidence": 0.82,
          "detector": "configuration-token",
          "excerpt_hash": "sha256:e159b85aed7f6310c4c4cdc7c8446e63259f2e78e2334b647b2e10f4f74b5955",
          "locator": "line:9",
          "source": "service.yaml"
        }
      ],
      "exposure": "internal",
      "finding_id": "finding-258dfa039da11219844d1f89",
      "key_bits": null,
      "library_version": null,
      "metadata": {},
      "protocol_version": null,